[
  {
    "window_id": 0,
    "start_timestamp": "2025-12-08T00:30:21.832063Z",
    "end_timestamp": "2025-12-08T00:30:27.648780Z",
    "is_drift": false,
    "is_simulated": true,
    "number_of_predictions": 100
  },
  {
    "window_id": 1,
    "start_timestamp": "2025-12-08T00:30:27.648786Z",
    "end_timestamp": "2025-12-08T00:30:33.559839Z",
    "is_drift": false,
    "is_simulated": true,
    "number_of_predictions": 100
  },
  {
    "window_id": 2,
    "start_timestamp": "2025-12-08T00:30:33.559846Z",
    "end_timestamp": "2025-12-08T00:30:39.575834Z",
    "is_drift": true,
    "is_simulated": true,
    "number_of_predictions": 100
  },
  {
    "window_id": 3,
    "start_timestamp": "2025-12-08T00:30:39.575853Z",
    "end_timestamp": "2025-12-08T00:30:45.616542Z",
    "is_drift": true,
    "is_simulated": true,
    "number_of_predictions": 100
  }
]